Index,Changed_article,Changed_json,Between_article,Between_json,Original_article,Original_json,first_topic_changed,second_topic_changed,third_topic_changed
100,"Syrian government shelling of a rebel-held town killed 31 people including two medics on Saturday as a two-year local truce broke down after suspected Al-Qaeda militants killed a captured regime pilot. The bombardment struck the town of Qamishli 60 kilometres (35 miles) northeast of Damascus where the army says Islamist rebels killed the pilot after he was forced to eject on Friday.

In its statement about the incident the military said the attack ""will not go unpunished."" The Syrian Observatory for Human Rights said Saturday's attack was the first bombardment of Qamishli in at least two years. ""Prominent figures in Qamishli have had a local truce with the regime for at least two years and neither fired on each other"" Observatory head Rami Abdel Rahman told AFP.

He said at least 31 people were killed including two medics. It was not immediately clear how many of the rest were civilians. Activists in the town said the head of the local medical centre and several colleagues were killed. ""There have been at least 45 air strikes today. The town's medical centre was hit and its director Amjad al-Danaf was killed"" activist Abu Malek al-Qamishli told AFP.

Al-Nusra Front (Al-Qaeda affiliate) was identified as one of the rebel groups responsible for the death of a captured regime pilot. Syrian government forces were blamed by the military for an attack on Hasaka that killed 31 people, including two medics. Qamishli's local truce with the regime had broken down after the suspected Al-Nusra Front militants killed a captured pilot.

The attacks also targeted a rebel-held territory near Idlib (implied by ""northeast"" and ""Damascus""). The Syrian army's shelling of Qamishli occurred on Saturday, May 1, 2015. The helicopter crash that killed three Syrian officers was caused by an explosion triggered by a rocket-propelled grenade launcher, which occurred on Thursday, April 15, 2015.","{'Name of casualty or group': '* Amjad al-Danaf (head of local medical centre)\\\\n* Two medics (no names mentioned)\\\\n* Three Syrian officers (no names mentioned)\\\\n* US officials (implied, but no specific names)', 'Gender or age group': '* At least 2 medics were killed.\\\\n* The head of the local medical centre, Amjad al-Danaf, was killed.\\\\n* No information on the gender or age group of the remaining casualties.', 'Cause of death': 'The cause of death for 31 people mentioned in the article is due to an explosion caused by a rocket-propelled grenade launcher.', 'Type': 'At least 31 people were killed, including two medics. It was unclear how many of the rest were civilians.', 'Actor': ""Al-Nusra Front (Al-Qaeda affiliate) was identified as one of the rebel groups responsible for the death of a captured regime pilot.\\\\nSyrian government forces were blamed by the military for an attack on Hasaka that killed 31 people, including two medics.\\\\nQamishli's local truce with the regime had broken down after the suspected Al-Nusra Front militants killed a captured pilot."", 'Place of death': 'The attacks occurred in Qamishli and Hasaka.\\\\nThe attacks also targeted a rebel-held territory near Idlib (implied by \\\\northeast\\\\\\ and \\\\\\\\Damascus\\\\\\).', 'Date of death': ""* The Syrian army's shelling of Qamishli occurred on Saturday, May 1, 2015.\\\\n* The helicopter crash that killed three Syrian officers occurred on Thursday, April 15, 2015.""}","Syrian government shelling of a rebel-held town killed 31 people including two medics on Saturday as a two-year local truce broke down after suspected Al-Qaeda militants killed a captured regime pilot. The bombardment struck the town of Qamishli 60 kilometres (35 miles) northeast of Damascus where the army says Islamist rebels killed the pilot after he was forced to eject on Friday.

In its statement about the incident the military said the attack ""will not go unpunished."" The Syrian Observatory for Human Rights said Saturday's attack was the first bombardment of Qamishli in at least two years. ""Prominent figures in Qamishli have had a local truce with the regime for at least two years and neither fired on each other"" Observatory head Rami Abdel Rahman told AFP.

He said at least 31 people were killed including two medics. It was not immediately clear how many of the rest were civilians. Activists in the town said the head of the local medical centre and several colleagues were killed. ""There have been at least 45 air strikes today. The town's medical centre was hit and its director Amjad al-Danaf was killed"" activist Abu Malek al-Qamishli told AFP.

Al-Nusra Front (Al-Qaeda affiliate) was identified as one of the rebel groups responsible for the death of a captured regime pilot. Syrian government forces were blamed by the military for an attack on Hasaka that killed 31 people, including two medics. Qamishli's local truce with the regime had broken down after the suspected Al-Nusra Front militants killed a captured pilot.

The attacks also targeted a rebel-held territory near Idlib (implied by ""northeast"" and ""Damascus""). The Syrian army's shelling of Qamishli occurred on Saturday, May 1, 2015. The helicopter crash that killed three Syrian officers occurred on Thursday, April 15, 2015.","{'Name of casualty or group': '* Amjad al-Danaf (head of local medical centre)\\\\n* Two medics (no names mentioned)\\\\n* Three Syrian officers (no names mentioned)\\\\n* US officials (implied, but no specific names)', 'Gender or age group': '* At least 2 medics were killed.\\\\n* The head of the local medical centre, Amjad al-Danaf, was killed.\\\\n* No information on the gender or age group of the remaining casualties.', 'Cause of death': 'The cause of death for 31 people mentioned in the article is Syrian government shelling. \\\\nGovernment helicopter crashed, killing three Syrian officers.\\\\nNo information about weapons used by suspected Al-Qaeda militants who killed a captured regime pilot.', 'Type': 'At least 31 people were killed, including two medics. It was unclear how many of the rest were civilians.', 'Actor': ""Al-Nusra Front (Al-Qaeda affiliate) was identified as one of the rebel groups responsible for the death of a captured regime pilot.\\\\nSyrian government forces were blamed by the military for an attack on Hasaka that killed 31 people, including two medics.\\\\nQamishli's local truce with the regime had broken down after the suspected Al-Nusra Front militants killed a captured pilot."", 'Place of death': 'The attacks occurred in Qamishli and Hasaka.\\\\nThe attacks also targeted a rebel-held territory near Idlib (implied by \\\\northeast\\\\ and \\\\Damascus\\\\).', 'Date of death': ""* The Syrian army's shelling of Qamishli occurred on Saturday, May 1, 2015.\\\\n* The helicopter crash that killed three Syrian officers occurred on Thursday, April 15, 2015.""}","2 medics among 31 dead in Syria army reprisal for slain pilot AFP Saturday 2 Jul 2016 Syrian government shelling of a rebel-held town killed 31 people including two medics on Saturday as a two-year local truce broke down after suspected Al-Qaeda militants killed a captured regime pilot. The bombardment struck the town of Jayrud 60 kilometres (35 miles) northeast of Damascus where the army says Islamist rebels killed the pilot after he was forced to eject on Friday. In its statement about the incident the military said the attack ""will not go unpunished."" The Syrian Observatory for Human Rights said Saturdays attack was the first bombardment of the town in at least two years. ""Prominent figures in Jayrud have had a local truce with the regime for at least two years and neither fired on each other"" Observatory head Rami Abdel Rahman told AFP. He said at least 31 people were killed including two medics. It was not immediately clear how many of the rest were civilians. Activists in the town said the head of the local medical centre and several colleagues were killed. ""There have been at least 45 air strikes today. The towns medical centre was hit and its director Amjad al-Danaf was killed"" activist Abu Malek al-Jayrudi told AFP via the Internet. He said the town is home to some 60000 people and that the bombardment had not stopped since early Saturday. Rebel groups in Jayrud include the Saudi-backed Jaish al-Islam (Army of Islam) the hardline Ahrar al-Sham and Al-Qaeda affiliate Al-Nusra Front. Jaish al-Islam spokesman Islam Alloush said on Friday that Al-Nusra Front had executed the air force pilot. Several government aircraft have been shot down by rebels or crashed because of technical faults since the civil war erupted five years ago. According to the Observatory three Syrian officers were killed on Friday when their helicopter crashed in the south near territory held by the Islamic State jihadist group. Abdel Rahman said government forces had managed to recover the bodies of the victims of the crash the cause of which remained unclear. ""We dont know if it was a technical issue or not but the bodies are with the regime"" Abdel Rahman said. Dozens of local truces have been brokered between the myriad of armed groups fighting in Syrias increasingly complex civil war. But a nationwide ceasefire between government forces and non-jihadist rebels brokered by Moscow and Washington in February has been repeatedly violated by both sides. US officials have accused Russia of not doing enough to rein in its ally President Bashar al-Assad. Moscow has countered that rebel groups that have failed to break ranks with Al-Qaeda and continue to fight alongside it are legitimate targets. The civil war which began with peaceful protests in 2011 has killed more than 280000 people and driven millions from their homes.","{'Name of casualty or group': '* Amjad al-Danaf (head of local medical centre)\n* Two medics (no names mentioned)\n* Three Syrian officers (no names mentioned)\n* US officials (implied, but no specific names)', 'Gender or age group': '* At least 2 medics were killed.\n* The head of the local medical centre, Amjad al-Danaf, was killed.\n* No information on the gender or age group of the remaining casualties.', 'Cause of death': 'The cause of death for 31 people mentioned in the article is Syrian government shelling. \nGovernment helicopter crashed, killing three Syrian officers.\nNo information about weapons used by suspected Al-Qaeda militants who killed a captured regime pilot.', 'Type': 'At least 31 people were killed, including two medics. It was unclear how many of the rest were civilians.', 'Actor': ""Al-Nusra Front (Al-Qaeda affiliate) was identified as one of the rebel groups responsible for the death of a captured regime pilot.\nSyrian government forces were blamed by the military for an attack on Jayrud that killed 31 people, including two medics.\nJayrud's local truce with the regime had broken down after the suspected Al-Nusra Front militants killed a captured pilot.\nNo information"", 'Place of death': 'The attacks occurred in Jayrud, a town northeast of Damascus.\nThe attacks also targeted a rebel-held territory near Daraa (implied by ""south"" and ""Islamic State jihadist group"").', 'Date of death': ""The Syrian army's shelling of Jayrud occurred on Saturday, July 2, 2016.\nThe helicopter crash that killed three Syrian officers occurred on Friday (no specific date given in article).""}",Place of death,Date of death,Cause of death
324,"Sat Nov 12 2016 Two People Poisoned by Toxic Gas in Terrorist Attack in Deir ez-Zor Residential Neighborhood. Two people have been poisoned from toxic gas released by terrorist groups in the Sulaymaniyah neighborhood of the Syrian city of Deir ez-Zor on Saturday. The militants based in the eastern part of Deir ez-Zor released toxic gas in the residential area of Sulaymaniyah in the western part of the city state news agency SANA reported. Some of the injured are in a serious condition. The Sulaymaniyah area is inhabited mainly by Christians and was the location of the October 13 mortar attack near a school which killed at least four children. The Syrian Armed Forces began a large-scale military operation in Deir ez-Zor after the September 12 truce brokered by Russia and the United States collapsed less than a week after it was endorsed. A violent conflict between the forces loyal to Syrian President Bashar Assad and opposition factions as well as terrorist groups has been raging in Syria for more than five years. The civilians, including women and children, were caught in the crossfire of this conflict.

- Civilians (General category encompassing men, women, and children) casualties,
Some of the injured are Christians (no specific age or gender mentioned),
Two people were poisoned from toxic gas released by terrorists.
Civilians (2 killed, 10 injured)
Terrorist groups (no specific group mentioned)
Deir ez-Zor
Saturday (no specific date mentioned, but the article states Sat Nov 12 2016 as the publication date)","{'Name of casualty or group': 'Civilians (General category encompassing men, women, and children)', 'Gender or age group': 'Some of the injured are in a serious condition (no specific age or gender mentioned), at least four children were killed in a mortar attack near a school on October 13.', 'Cause of death': 'Two people were poisoned from toxic gas released by terrorists.', 'Type': 'Civilians (2 killed, 10 injured)', 'Actor': 'Terrorist groups (no specific group mentioned)', 'Place of death': 'Deir ez-Zor', 'Date of death': 'Saturday (no specific date mentioned, but the article states Sat Nov 12 2016 as the publication date)'}",Sat Nov 12 2016 Two People Poisoned by Toxic Gas in Terrorist Attack in Deir ez-Zor Residential Neighborhood. Two people have been poisoned from toxic gas released by terrorist groups in the Sulaymaniyah neighborhood of the Syrian city of Deir ez-Zor on Saturday. The militants based in the eastern part of Deir ez-Zor released toxic gas in the residential area of Sulaymaniyah in the western part of the city state news agency SANA reported. Some of the injured are in a serious condition. The Sulaymaniyah area is inhabited mainly by Christians and was the location of the October 13 mortar attack near a school which killed at least four children. The Syrian Armed Forces began a large-scale military operation in Deir ez-Zor after the September 12 truce brokered by Russia and the United States collapsed less than a week after it was endorsed. A violent conflict between the forces loyal to Syrian President Bashar Assad and opposition factions as well as terrorist groups has been raging in Syria for more than five years. 218-11,"{'Name of casualty or group': '- 2 people killed \\\\n- Terrorists groups (shelling perpetrators) \\\\n- Some of the injured are Christians \\\\n- Syrian Armed Forces casualties (not explicitly stated, but mentioned as forces loyal to Syrian President Bashar Assad)', 'Gender or age group': 'Some of the injured are in a serious condition (no specific age or gender mentioned), at least four children were killed in a mortar attack near a school on October 13.', 'Cause of death': 'Two people were poisoned from toxic gas released by terrorists.', 'Type': 'Civilians (2 killed, 10 injured)', 'Actor': 'Terrorist groups (no specific group mentioned)', 'Place of death': 'Deir ez-Zor', 'Date of death': 'Saturday (no specific date mentioned, but the article states Sat Nov 12 2016 as the publication date)'}",Sat Nov 12 2016 2 Killed 10 Injured in Terrorist Shelling in Aleppo Residential Neighborhood. Two people have been killed and 10 other people have been injured in a terrorists groups shelling of the Sulaymaniyah neighborhood of the Syrian city of Aleppo on Saturday. The militants based in the eastern part of Aleppo shelled residential area of Sulaymaniyah in the western part of the city state news agency SANA reported. Some of the injured are in a serious condition. The Sulaymaniyah area is inhabited mainly by Christians and was the location of the October 13 mortar attack near a school which killed at least four children. The Syrian Armed Forces began a large-scale military operation in Aleppo after the September 12 truce brokered by Russia and the United States collapsed less than a week after it was endorsed. A violent conflict between the forces loyal to Syrian President Bashar Assad and opposition factions as well as terrorist groups has been raging in Syria for more than five years. 218-11,"{'Name of casualty or group': '- 2 people killed \n- Terrorists groups (shelling perpetrators) \n- Some of the injured are Christians \n- Syrian Armed Forces casualties (not explicitly stated, but mentioned as ""forces loyal to Syrian President Bashar Assad"")', 'Gender or age group': 'Some of the injured are in a serious condition (no specific age or gender mentioned), at least four children were killed in a mortar attack near a school on October 13.', 'Cause of death': ""Two people have been killed by terrorist groups' shelling."", 'Type': 'Type: Terrorist groups (attackers) - No information on Type of casualty.\nType of Casualty: Civilians (2 killed, 10 injured)', 'Actor': '* Actor: Terrorist groups (no specific group mentioned)', 'Place of death': 'The Sulaymaniyah neighborhood of Aleppo.', 'Date of death': '* Date of attack: Saturday (no specific date mentioned, but the article states ""Sat Nov 12 2016"" as the publication date)'}",Cause of death,Place of death,Name of casualty or group
340,"09.10.2013 A devastating shelling attack in the western Syrian city of Homs has claimed the lives of 18 civilians, including 10 children, Lebanese TV channel Al-Mayadin reported. MOSCOW September 10 (RIA Novosti) - A devastating shelling attack in the western Syrian city of Homs has claimed the lives of 18 civilians, including 10 children, Lebanese TV channel Al-Mayadin reported. According to earlier media reports, several artillery shells exploded on residential areas near the Akrameh al-Makhzumi school and the Zaim hospital in the city's Akrameh region. The Syrian Democratic Forces (SDF) have been accused of carrying out the attack. An armed conflict has been taking place in Syria since 2011. According to the United Nations, the war has claimed more than 191000 lives while more than three million Syrians have become refugees, and over 108 million - nearly half of the country's population - is in need of humanitarian assistance.","{'Name of casualty or group': '10', 'Gender or age group': '10 children were among the casualties.\\n18 civilians were killed, which includes the 10 children.', 'Cause of death': 'The cause of death for the civilians was a shelling attack on residential areas.', 'Type': 'Civilians (18 people, including 10 children) are reported as casualties.', 'Actor': 'Syrian Democratic Forces (SDF)', 'Place of death': ""a shelling attack occurred on residential areas near the Akrameh al-Makhzumi school and the Zaim hospital in the city's Akrameh region."", 'Date of death': 'September 10, 2013 (no specific time mentioned)'}","09.10.2013 A devastating shelling attack in the western Syrian city of Homs has claimed the lives of 18 civilians, including 10 children, Lebanese TV channel Al-Mayadin reported. MOSCOW September 10 (RIA Novosti) - A devastating shelling attack in the western Syrian city of Homs has claimed the lives of 18 civilians, including 10 children, Lebanese TV channel Al-Mayadin reported. According to earlier media reports, several artillery shells exploded on residential areas near the Akrameh al-Makhzumi school and the Zaim hospital in the city's Akrameh region. An armed conflict has been taking place in Syria since 2011. According to the United Nations, the war has claimed more than 191000 lives while more than three million Syrians have become refugees, and over 108 million - nearly half of the country's population - is in need of humanitarian assistance.","{'Name of casualty or group': '10', 'Gender or age group': '10 children were among the casualties.\\n18 civilians were killed, which includes the 10 children.', 'Cause of death': 'The cause of death for the civilians was a shelling attack on residential areas.', 'Type': 'Civilians (18 people, including 10 children) are reported as casualties.', 'Actor': '* No specific actors are mentioned as responsible for the attack, only that it was described as a \\shelling attack\\.', 'Place of death': ""a shelling attack occurred on residential areas near the Akrameh al-Makhzumi school and the Zaim hospital in the city's Akrameh region."", 'Date of death': 'September 10, 2013 (no specific time mentioned)'}",01.10.2014 A double terrorist attack in the western Syrian city of Homs has claimed the lives of 18 civilians including 10 children Lebanese TV channel Al-Mayadin reported. MOSCOW October 1 (RIA Novosti) - A double terrorist attack in the western Syrian city of Homs has claimed the lives of 18 civilians including 10 children Lebanese TV channel Al-Mayadin reported. According to earlier media reports two car bombs went off near the Akrameh al-Makhzumi school and the Zaim hospital in the citys Akrameh region. An armed conflict has been taking place in Syria since 2011. According to the United Nations the war has claimed more than 191000 lives while more than three million Syrians have become refugees and over 108 million nearly half of the countrys population is in need of humanitarian assistance.,"{'Name of casualty or group': '- Civilians: 18\n- Children: 10', 'Gender or age group': '10 children were among the casualties.\n18 civilians were killed, which includes the 10 children.', 'Cause of death': 'The cause of death for the civilians was a double terrorist attack involving car bombs.', 'Type': 'Type: Civilians (18 people, including 10 children) are reported as casualties.', 'Actor': '* No specific actors are mentioned as responsible for the attack, only that it was described as a ""double terrorist attack"".', 'Place of death': ""* Homs: a double terrorist attack occurred with car bombs near the Akrameh al-Makhzumi school and the Zaim hospital in the city's Akrameh region."", 'Date of death': 'Date of death: October 1, 2014 (no specific time mentioned)'}",Cause of death,Date of death,Actor
