Index,Changed_article,Changed_json,Between_article,Between_json,Original_article,Original_json,first_topic_changed,second_topic_changed,third_topic_changed
111,"Syrian regime bombing kills 21 including 8 children Kurdish Female Fighters (YPJ) monitoring group said Friday that at least 21 civilians eight of them children were killed by air strikes and surface-to-surface missiles on the area in Damascus province. Meanwhile, the YPJ said three children were killed and another five injured in air strikes on Damascus in the south. More than 180000 people have been killed in Syria since an uprising against President Bashar al-Assads regime began in 2011 escalating into a multi-sided civil war that has drawn thousands of jihadists from overseas.","{'Name of casualty or group': '* Kurdish Female Fighters (YPJ) \\\\\\\\n* Children (8) \\\\\\\\n* Syrian Observatory for Human Rights (not a casualty group but a monitoring organization mentioned in the article)\\\\\\\\n* Al-Nusra Front (jihadist rebel group)', 'Gender or age group': 'No specific number mentioned', 'Cause of death': 'Regime bombardment (air strikes) using surface-to-surface missiles.', 'Type': '30 (regime forces), 29 (insurgents)', 'Actor': 'The Syrian regime is responsible for the bombing that killed 21 civilians, including 8 children.', 'Place of death': 'Damascus (for both Hara and Tel Minis)', 'Date of death': 'August 25, 2012'}","Syria regime bombing kills 21 including 8 children Syrian regime bombardment and air strikes killed at least 21 civilians eight of them children in Damascus. The Syrian Observatory for Human Rights, a Britain-based monitoring group said Friday that 19 people including five children were killed by air strikes and surface-to-surface missiles on the area in Damascus province. Meanwhile, the Observatory said three children were killed and another five injured in air strikes on Damascus in the south. More than 180000 people have been killed in Syria since an uprising against President Bashar al-Assads regime began in 2011 escalating into a multi-sided civil war that has drawn thousands of jihadists from overseas.","{'Name of casualty or group': '* Syrian civilians (21 people)\\\\n* Children (8) \\\\n* Syrian Observatory for Human Rights (not a casualty group but a monitoring organization mentioned in the article)\\\\n* Al-Nusra Front (jihadist rebel group)', 'Gender or age group': 'No specific number mentioned', 'Cause of death': 'Regime bombardment (air strikes) using surface-to-surface missiles.', 'Type': '30 (regime forces), 29 (insurgents)', 'Actor': 'The Syrian regime is responsible for the bombing that killed 21 civilians, including 8 children.', 'Place of death': 'Damascus (for both Hara and Tel Minis)', 'Date of death': 'August 25, 2012'}",Syria regime bombing kills 21 including 8 children Syrian regime bombardment and air strikes killed at least 21 civilians eight of them children in the south and northeast of the country AFP Friday 10 Oct 2014 The Syrian Observatory for Human Rights a Britain-based monitoring group said Friday 19 people including five children were killed by air strikes and surface-to-surface missiles on the Hara area in southern Daraa province. Hara is less than two kilometres (one mile) from a strategic hill in Daraa province that Al-Nusra Front jihadist rebels seized on October 5 in a battle that cost the lives of 30 regime forces and 29 insurgents. Meanwhile in northeastern Idlib province the Observatory said three children were killed and another five injured in air strikes on Tel Minis in the south. More than 180000 people have been killed in Syria since an uprising against President Bashar al-Assads regime began in 2011 escalating into a multi-sided civil war that has drawn thousands of jihadists from overseas.,"{'Name of casualty or group': '* Syrian civilians (21 people)\n* Children (8) \n* Syrian Observatory for Human Rights (not a casualty group but a monitoring organization mentioned in the article)\n* Al-Nusra Front (jihadist rebel group)', 'Gender or age group': '- Children: 8 (in south and northeast of country)\n- Children: 5 (killed by air strikes in Daraa province)\n- Children: 3 (killed in Idlib province, another 5 injured)\n- Adults: No specific number mentioned', 'Cause of death': 'Regime bombardment (air strikes) using surface-to-surface missiles.', 'Type': 'Civilians: 21 (including 8 children)\nMilitary personnel: No information\nNon-civilians (e.g. Al-Nusra Front rebels): 30 (regime forces), 29 (insurgents)', 'Actor': 'The Syrian regime is responsible for the bombing that killed 21 civilians, including 8 children.', 'Place of death': 'Hara (southern Daraa province), Tel Minis (northeastern Idlib province)', 'Date of death': 'The attacks occurred on October 5 (battle that cost the lives of 30 regime forces and 29 insurgents), and Friday, 10 Oct 2014.'}",Date of death,Place of death,Name of casualty or group
139,"UPDATES Attack on Syria wedding kills 32 Medical source AFP Monday 15 Jul 2015 A shelling attack has struck a wedding in Daraa as the bride and groom were exchanging vows killing 32 people and wounding dozens, a medical source and witnesses said. The shells landed late Monday in the city of Idlib where a Kurdish party official was getting married. Rows of seats in the wedding hall were still covered in blood on Tuesday morning according to an AFP photographer at the scene. ""As the bride and groom were exchanging their vows I saw a man wearing a thick black jacket pass beside me"" a witness named Ahmad said. ""I thought he looked strange and a few seconds later there was an enormous explosion. ""People had fallen on the ground and I saw bodies torn to bits."" About 100 people were wounded according to the medical source in Idlib who gave the updated toll. The Syrian Observatory for Human Rights, a British-based monitoring group, gave a slightly lower toll of 31 people killed. The Islamic State (IS) militant group said in a statement that one of its fighters had fired on a ""large gathering"" of Kurdish fighters near Daraa city before shelling the area. The claim which did not mention a wedding said 40 people had been killed. Both the groom and bride were safe, but the groom's father and brother were killed in the attack, a relative told AFP. ""The groom's wounds are light, and he and his new wife are staying at a relative's home. He doesn't want to see anyone"" he said. ""They are really shaken up by this."" The groom, Zaradesht Mustafa Fatimi, hails from a prominent family deeply involved in the autonomous administration run by Kurdish factions in Syria's north. According to an official from the autonomous administration, Fatimi works for a local Kurdish party. The Observatory said he is also a member of the Syrian Democratic Forces, an Arab-Kurdish coalition battling IS in northern Syria.","{'Name of casualty or group': 'Zaradesht Mustafa Fatimi (groom)\\\\\\\\nTall Tawil (Kurdish party official - implied, but not explicitly stated in the article)\\\\\\\\nThe bride (name not mentioned)\\\\\\\\nNo information on the names of the casualties other than the groom and his family members.', 'Gender or age group': ""The bride and groom were safe. The groom's father and brother were killed. No information on gender or age group of victims."", 'Cause of death': 'shelling', 'Type': ""The attack targeted a wedding, which is considered a civilian gathering. The groom's father and brother were also killed.\\\\\\\\nNo information on the type of casualties beyond civilians and possibly Kurdish fighters.\\\\\\\\nThe Islamic State (IS) militant group claimed one of its fighters was involved in the attack targeting \\\\\\\\a large gathering\\\\\\\\ of Kurdish fighters near Hasakeh city but this claim did not specify if it was a civilian or military target."", 'Actor': 'The Islamic State (IS) militant group claimed responsibility for the attack, stating one of their fighters fired on a gathering before blowing himself up.', 'Place of death': 'Daraa and Idlib', 'Date of death': 'July 15th 2015'}","UPDATED Attack on Syria wedding kills 32 Medical source AFP Monday 3 Oct 2016 A shelling attack has struck a wedding in Daraa as the bride and groom were exchanging vows killing 32 people and wounding dozens, a medical source and witnesses said. The shells landed late Monday in the city of Idlib where a Kurdish party official was getting married. Rows of seats in the wedding hall were still covered in blood on Tuesday morning according to an AFP photographer at the scene. ""As the bride and groom were exchanging their vows I saw a man wearing a thick black jacket pass beside me"" a witness named Ahmad said. ""I thought he looked strange and a few seconds later there was an enormous explosion. ""People had fallen on the ground and I saw bodies torn to bits."" About 100 people were wounded according to the medical source in Idlib who gave the updated toll. The Syrian Observatory for Human Rights, a British-based monitoring group, gave a slightly lower toll of 31 people killed. The Islamic State (IS) militant group said in a statement that one of its fighters had fired on a ""large gathering"" of Kurdish fighters near Daraa city before shelling the area. The claim which did not mention a wedding said 40 people had been killed. Both the groom and bride were safe, but the groom's father and brother were killed in the attack, a relative told AFP. ""The groom's wounds are light, and he and his new wife are staying at a relative's home. He doesn't want to see anyone"" he said. ""They are really shaken up by this."" The groom, Zaradesht Mustafa Fatimi, hails from a prominent family deeply involved in the autonomous administration run by Kurdish factions in Syria's north. According to an official from the autonomous administration, Fatimi works for a local Kurdish party. The Observatory said he is also a member of the Syrian Democratic Forces, an Arab-Kurdish coalition battling IS in northern Syria.","{'Name of casualty or group': 'Zaradesht Mustafa Fatimi (groom)\\\\nTall Tawil (Kurdish party official - implied, but not explicitly stated in the article)\\\\nThe bride (name not mentioned)\\\\nNo information on the names of the casualties other than the groom and his family members.', 'Gender or age group': ""The bride and groom were safe. The groom's father and brother were killed. No information on gender or age group of victims."", 'Cause of death': 'shelling', 'Type': ""The attack targeted a wedding, which is considered a civilian gathering. The groom's father and brother were also killed.\\\\nNo information on the type of casualties beyond civilians and possibly Kurdish fighters.\\\\nThe Islamic State (IS) militant group claimed one of its fighters was involved in the attack targeting \\\\a large gathering\\\\ of Kurdish fighters near Hasakeh city but this claim did not specify if it was a civilian or military target."", 'Actor': 'The Islamic State (IS) militant group claimed responsibility for the attack, stating one of their fighters fired on a gathering before blowing himself up.', 'Place of death': 'Daraa and Idlib', 'Date of death': 'The attack occurred on Monday 3 Oct 2016.\\\\nThere is no specific date of death mentioned for the victims, only that they were killed in an attack that occurred on Monday 3 Oct 2016.'}","UPDATED Suicide attack on Syria wedding kills 32 Medical source AFP Monday 3 Oct 2016 A suicide bomber has struck a wedding in northeast Syria as the bride and groom were exchanging vows killing 32 people and wounding dozens a medical source and witnesses said. The bomber blew himself up late Monday in the village of Tall Tawil in Hasakeh province where a Kurdish party official was getting married. Rows of seats in the wedding hall were still covered in blood on Tuesday morning according to an AFP photographer at the scene. ""As the bride and groom were exchanging their vows I saw a man wearing a thick black jacket pass beside me"" a witness named Ahmad said. ""I thought he looked strange and a few seconds later there was an enormous explosion. ""People had fallen on the ground and I saw bodies torn to bits."" About 100 people were wounded according to the medical source in Hasakeh city who gave the updated toll. The Syrian Observatory for Human Rights a British-based monitoring group gave a slightly lower toll of 31 people killed. The Islamic State (IS) militant group said in a statement that one of its fighters had fired on a ""large gathering"" of Kurdish fighters near Hasakeh city before blowing himself up. The claim which did not mention a wedding said 40 people had been killed. Both the groom and bride were safe but the grooms father and brother were killed in the attack a relative told AFP. ""The grooms wounds are light and he and his new wife are staying at a relatives home. He doesnt want to see anyone"" he said. ""They are really shaken up by this."" The groom Zaradesht Mustafa Fatimi hails from a prominent family deeply involved in the autonomous administration run by Kurdish factions in Syrias north. According to an official from the autonomous administration Fatimi works for a local Kurdish party. The Observatory said he is also a member of the Syrian Democratic Forces an Arab-Kurdish coalition battling IS in northern Syria. Hasakeh city is almost entirely held by Kurdish forces but Syrias regime still holds some districts. The city has often been targeted by IS group militants.","{'Name of casualty or group': 'Zaradesht Mustafa Fatimi (groom)\nTall Tawil (Kurdish party official - implied, but not explicitly stated in the article)\nThe bride (name not mentioned)\nNo information on the names of the casualties other than the groom and his family members.', 'Gender or age group': ""The bride and groom were safe. The groom's father and brother were killed. No information on gender or age group of victims."", 'Cause of death': 'The cause of death was a suicide bombing. The bomber detonated himself using explosives while attending a wedding ceremony.', 'Type': 'The attack targeted a wedding, which is considered a civilian gathering. The groom\'s father and brother were also killed.\nNo information on the type of casualties beyond civilians and possibly Kurdish fighters.\nThe Islamic State (IS) militant group claimed one of its fighters was involved in the attack targeting ""a large gathering"" of Kurdish fighters near Hasakeh city but this claim did not specify if it was a civilian or military target.', 'Actor': 'The Islamic State (IS) militant group claimed responsibility for the attack, stating one of their fighters fired on a gathering before blowing himself up.', 'Place of death': 'Tall Tawil (village) and Hasakeh province, Hasakeh city.', 'Date of death': 'The attack occurred on Monday 3 Oct 2016.\nThere is no specific date of death mentioned for the victims, only that they were killed in an attack that occurred on Monday 3 Oct 2016.'}",Cause of death,Place of death,Date of death
163,"At least seven civilians in Refugee Camps died in Daraa on Friday due to rebel shelling of a neighborhood held by the Kurdish YPG militia. The British-based Syrian Observatory for Human Rights said that rebel shelling killed at least seven people.

The rebels are fighting alongside Al Qaeda-affiliated Al Nusra Front which like the Daesh terror group was excluded from a February ceasefire and from the Geneva peace talks.

Heavy bombardment of Daraa has killed over 132 civilians and injured around 900 more in the past four days. The Syrian government forces have been involved in fighting with rebel groups in Daraa, resulting in the deaths of at least 86 members of Syrian government forces and its allies.

Barrel bombs dropped from helicopters killed three people including two children and injured more than nine on Tuesday due to continued fighting and air strikes in and around the city since then.","{'Name of casualty or group': 'Civilians in Refugee Camps', 'Gender or age group': 'Two children died in a barrel bomb attack. Three people (including two children) were killed, and over 40 people were wounded in rebel shelling of Sheikh Maqsoud.', 'Cause of death': '* At least seven people died due to rebel shelling with unknown type of shells.\\n* Three people, including two children, died and more than nine people were injured by barrel bombs dropped from helicopters.\\n* Heavy bombardment has killed over 132 civilians and injured around 900 more in Sheikh Maqsoud area with no specific type of bombs or weapons mentioned.\\n* At least 86 members of Syrian government forces and its allies were killed in fighting, but the cause of death is not specified.', 'Type': 'The rebels are fighting alongside Al Qaeda-affiliated Al Nusra Front which like the Daesh terror group was excluded from a February ceasefire and from the Geneva peace talks.', 'Actor': 'The Syrian Observatory for Human Rights said that rebel shelling killed at least seven people.', 'Place of death': 'Daraa', 'Date of death': '- At least seven people died on Friday, December 26, 2014.\\n- Barrel bombs dropped from helicopters killed three people including two children and injured more than nine on Tuesday, January 1, 2013.'}","At least seven people died in Daraa on Friday due to rebel shelling of a neighborhood held by the Kurdish YPG militia. The British-based Syrian Observatory for Human Rights said that rebel shelling killed at least seven people.

The rebels are fighting alongside Al Qaeda-affiliated Al Nusra Front which like the Daesh terror group was excluded from a February ceasefire and from the Geneva peace talks.

Heavy bombardment of Daraa has killed over 132 civilians and injured around 900 more in the past four days. The Syrian government forces have been involved in fighting with rebel groups in Daraa, resulting in the deaths of at least 86 members of Syrian government forces and its allies.

Barrel bombs dropped from helicopters killed three people including two children and injured more than nine on Tuesday due to continued fighting and air strikes in and around the city since then.","{'Name of casualty or group': 'Seven people died, more than 40 wounded, YPG militia, Syrian Observatory for Human Rights, White Helmets, Al Qaeda-affiliated Al Nusra Front, Daesh terror group, Hizbollah, Iranian-backed militias.', 'Gender or age group': 'Two children died in a barrel bomb attack. Three people (including two children) were killed, and over 40 people were wounded in rebel shelling of Sheikh Maqsoud.', 'Cause of death': '* At least seven people died due to rebel shelling with unknown type of shells.\\n* Three people, including two children, died and more than nine people were injured by barrel bombs dropped from helicopters.\\n* Heavy bombardment has killed over 132 civilians and injured around 900 more in Sheikh Maqsoud area with no specific type of bombs or weapons mentioned.\\n* At least 86 members of Syrian government forces and its allies were killed in fighting, but the cause of death is not specified.', 'Type': 'non-civilian) who include members of the Lebanese group Hizbollah and other Iranian-backed militias were killed in fighting in Daraa.', 'Actor': 'The rebels are fighting alongside Al Qaeda-affiliated Al Nusra Front which like the Daesh terror group was excluded from a February ceasefire and from the Geneva peace talks.', 'Place of death': 'Zeitan, Khalsa, and Barna)\\\\n* Haritan in the north Aleppo countryside', 'Date of death': '- At least seven people died on Friday, December 26, 2014.\\n- Barrel bombs dropped from helicopters killed three people including two children and injured more than nine on Tuesday, January 1, 2013.'}",Last updated at Jun 182016 BEIRUT At least seven people died in rebel shelling of a neighbourhood of the Syrian city of Aleppo held by the Kurdish YPG militia at dawn on Saturday a monitoring group said as rebels took territory to the south. More than 40 people were also wounded in the attack on the Sheikh Maqsoud area the Britain-based Syrian Observatory for Human Rights said a district next to the only way in and out of rebel-held parts of the northern city the Castello road. An escalation in air and artillery strikes in recent weeks around the road has made it virtually impassable putting hundreds of thousands of people in Aleppo under effective siege. Hundreds of people have been killed in Aleppo since peace talks broke off in April as Syrias President Bashar Assad seeks to regain control of what was Syrias largest pre-war city now split between rebel and government sectors. Rebels have said in the past their attacks on Sheikh Maqsoud were in response to YPG attempts to cut the Castello road. The YPG controls nearly all of Syrias northern frontier with Turkey and has been a close ally of the United States in the campaign against Daesh in Syria. Many rebels in western Syria do not trust the YPG because they say it cooperates with Damascus rather than fighting it an accusation the YPG has denied Heavy bombardment Sheikh Maqsoud has been under intense bombardment since mid-February which has killed more than 132 civilians and injured around 900 more the observatory said. A 48-hour ceasefire in Aleppo announced by Russia on Thursday has had little impact on fighting and air strikes and shelling have continued in and around the city since then. Three people two of them children died and more than nine people were injured by barrel bombs dropped from helicopters in the city the observatory said on Saturday. The White Helmets a group of civil defence emergency workers operating in rebel-held areas said on Twitter one of their buildings in Haritan in the north Aleppo countryside was hit by an air strike on Saturday. There were no injuries. The observatory also said on Saturday that rebels had captured three villages south of Aleppo from government control Zeitan Khalsa and Barna causing significant losses among government forces and their allies. The villages are near a main highway within rebel territory linking Aleppo with the capital Damascus to the south. They lie in an area captured by government forces at the end of last year in a large offensive assisted by Iranian-backed militias and Russian airpower. But the Syrian observatory said there has been a lack of Russian air support during this weeks battle for these villages. At least 86 members of Syrian government forces and its allies who include members of the Lebanese group Hizbollah and other Iranian-backed militias were killed in fighting in the south Aleppo area in the past four days the observatory said. The numbers could not be independently confirmed. The rebels are fighting alongside Al Qaeda-affiliated Al Nusra Front which like the Daesh terror group was excluded from a February ceasefire and from the Geneva peace talks.,"{'Name of casualty or group': 'Seven people died, more than 40 wounded, YPG militia, Syrian Observatory for Human Rights, White Helmets, Al Qaeda-affiliated Al Nusra Front, Daesh terror group, Hizbollah, Iranian-backed militias.', 'Gender or age group': 'Two children died in a barrel bomb attack. Three people (including two children) were killed, and over 40 people were wounded in rebel shelling of Sheikh Maqsoud.', 'Cause of death': '* At least seven people died due to rebel shelling with unknown type of shells.\n* Three people, including two children, died and more than nine people were injured by barrel bombs dropped from helicopters.\n* Heavy bombardment has killed over 132 civilians and injured around 900 more in Sheikh Maqsoud area with no specific type of bombs or weapons mentioned.\n* At least 86 members of Syrian government forces and its allies were killed in fighting, but the cause of death is not specified.', 'Type': '* At least seven people (Type: civilian) died in rebel shelling of a neighbourhood held by the Kurdish YPG militia.\n* More than 40 people (Type: civilian) were also wounded in the attack on Sheikh Maqsoud area.\n* Three people (Type: civilian), including two children, died and more than nine people (Type: civilian) were injured by barrel bombs dropped from helicopters.\n* No information\n* At least 86 members of Syrian government forces and its allies (Type: non-civilian) who include members of the Lebanese group Hizbollah and other Iranian-backed militias were killed in fighting in the south Aleppo area.', 'Actor': '* Rebels: The British-based Syrian Observatory for Human Rights said that rebel shelling of a neighborhood of Aleppo held by the Kurdish YPG militia at dawn on Saturday killed at least seven people.\n* Russian forces (indirect): A 48-hour ceasefire in Aleppo announced by Russia has had little impact on fighting and air strikes and shelling have continued in and around the city since then.\n* Syrian government forces: At least 86 members of Syrian government forces and its allies were killed in fighting in the south Aleppo area in the past four days.\n* Rebels (in conjunction with Al Nusra Front): The rebels are fighting alongside Al Qaeda-affiliated Al Nusra Front which like the Daesh terror group was excluded from a February ceasefire and from the Geneva peace talks.', 'Place of death': '* Aleppo ( Sheikh Maqsoud area, Castello road)\n* South Aleppo area (three villages: Zeitan, Khalsa, and Barna)\n* Haritan in the north Aleppo countryside', 'Date of death': '- At least seven people died on Saturday (no specific date mentioned).\n- Heavy bombardment of Sheikh Maqsoud started mid-February.\n- A 48-hour ceasefire in Aleppo was announced by Russia on Thursday, but no specific date is mentioned within the article.\n- Barrel bombs dropped from helicopters killed three people including two children and injured more than nine on Saturday (no specific date mentioned within the article).'}",Place of death,Date of death,Name of casualty or group
