Index,Changed_article,Changed_json,Between_article,Between_json,Original_article,Original_json,first_topic_changed,second_topic_changed,third_topic_changed
148,,"{'Name of casualty or group': 'Kurdish Female Fighters (YPJ)', 'Gender or age group': 'At least 21 people killed, including 3 children.', 'Cause of death': ""* The cause of death is an air strike (specifically, a bombing campaign) on a market area. * The regime's use of aerial offensive targeting opposition-held areas is responsible for hundreds of deaths."", 'Type': 'No information', 'Actor': 'The actor responsible for the air strike is the Syrian regime, specifically the army.', 'Place of death': 'Deir ez-Zor Daraa Qamishli', 'Date of death': 'December 12, 2013'}","Air raid kills 21 at Syria market Monitor AFP Thursday 4 Dec 2013 An air strike on a market on Thursday killed at least 21 people including three children in Deir ez-Zor, Daraa and Qamishli. a monitoring group said. The deadly raid comes amid a massive aerial offensive targeting opposition-held areas across the country that began in December 15. The Syrian Observatory for Human Rights said the bombing campaign has killed hundreds mostly civilians and forced thousands of families to flee their homes. ""The number of people killed in an air strike this morning against the market area has risen to 21 including three children"" said the Observatory adding the toll was likely to rise. Activists distributed video showing scenes of chaos with bodies lying amid mounds of grey rubble in what was clearly a market. The amateur footage shows a woman in a white headscarf screaming as she leaned over the body of a loved one. Another image showed a man attending to a boy whose leg had been ripped off. It was unclear whether the child was alive or dead. ""The area that was struck today is a market area thats why there were so many civilians killed"" said Daraa-based activist Abu Omar. ""The regime is hitting back against the civilians who support the revolt"" against President Bashar al-Assad he added. Swathes of Deir ez-Zor, Daraa and Qamishli have been out of army control since 2012. Human Rights Watch has accused Syrias regime of ""wreaking disaster"" with its air strikes on the area. More than 150000 people have been killed in Syrias three-year war which broke out after the regime unleashed a massive crackdown against a protest movement demanding political change. The violence has forced nearly half of Syrias population to flee their homes.","{'Name of casualty or group': 'The Syrian Observatory for Human Rights\\\\n3 children\\\\n21 civilians (including the 3 children)', 'Gender or age group': 'At least 21 people killed, including 3 children.', 'Cause of death': ""* The cause of death is an air strike (specifically, a bombing campaign) on a market area.\\\\n* The regime's use of aerial offensive targeting opposition-held areas is responsible for hundreds of deaths."", 'Type': 'No information', 'Actor': 'The actor responsible for the air strike is the Syrian regime, specifically the army.', 'Place of death': 'Deir ez-Zor\\\\nDaraa\\\\nQamishli', 'Date of death': 'December 12, 2013'}","Air raid kills 21 at Syria market Monitor AFP Thursday 24 Apr 2014 An air strike on a market on Thursday killed at least 21 people including three children in a village of the north Syrian province of Aleppo a monitoring group said. The deadly raid comes amid a massive aerial offensive targeting opposition-held areas across Aleppo city and province that began in December 15. The Syrian Observatory for Human Rights said the bombing campaign has killed hundreds mostly civilians and forced thousands of families to flee their homes. ""The number of people killed in an air strike this morning against the market area of Atareb village has risen to 21 including three children"" said the Observatory adding the toll was likely to rise. Activists distributed video showing scenes of chaos with bodies lying amid mounds of grey rubble in what was clearly a market. The amateur footage shows a woman in a white headscarf screaming as she leaned over the body of a loved one. Another image showed a man attending to a boy whose leg had been ripped off. It was unclear whether the child was alive or dead. ""The area that was struck today is a market area thats why there were so many civilians killed"" said Aleppo-based activist Abu Omar. ""The regime is hitting back against the civilians who support the revolt"" against President Bashar al-Assad he added. Swathes of Aleppo city and province have been out of army control since 2012. Human Rights Watch has accused Syrias regime of ""wreaking disaster"" with its air strikes on the area. More than 150000 people have been killed in Syrias three-year war which broke out after the regime unleashed a massive crackdown against a protest movement demanding political change. The violence has forced nearly half of Syrias population to flee their homes.","{'Name of casualty or group': 'The Syrian Observatory for Human Rights\n3 children\n21 civilians (including the 3 children)', 'Gender or age group': 'At least 21 people killed, including 3 children.', 'Cause of death': ""* The cause of death is an air strike (specifically, a bombing campaign) on a market area.\n* The regime's use of aerial offensive targeting opposition-held areas is responsible for hundreds of deaths."", 'Type': '* Type: Civilians (21 killed, including 3 children)\n* Non-civilians: No information', 'Actor': 'The actor responsible for the air strike is the Syrian regime, specifically the army.', 'Place of death': 'Atareb village (in Aleppo province)\nAleppo city and province (multiple locations)', 'Date of death': 'The air strike occurred on Thursday, April 24, 2014. The aerial offensive began on December 15 (no date of death mentioned).'}",Place of death,Date of death,Name of casualty or group
285,"Wednesday 5 April 2016 Russian forces responsible for awful Syria chemical attack: EUs Mogherini . EU diplomatic chief Federica Mogherini said Wednesday Russian forces bear primary responsibility for a suspected chemical attack, according to her. A Russian military source denied any involvement.\nThe attack caused many people to choke or faint and some had foam coming out of their mouths, a sign of a gas attack. Chemical weapons believed to be sarin and chlorine were used.

Wednesday 5 April 2016: The suspected chemical attack occurred on Wednesday.

No specific date is mentioned in the article, but it's implied to be Wednesday 5 April 2016.

The attack killed at least 58 people, including Syrian Civilians living in Khan Sheikhoun. Russian forces bear primary responsibility for a suspected chemical attack. The attack targeted the town of Khan Sheikhoun in the south of Idlib.

Wednesday 5 April 2016 Russian forces bear primary responsibility for a suspected chemical attack. Civilians and rebels were among the wounded.","{'Name of casualty or group': 'Syrian Civilians living in Khan Sheikhoun', 'Gender or age group': '* The attack killed at least 58 people, including 11 children under the age of eight.\\n* Some victims had foam coming out of their mouths.', 'Cause of death': 'The attack caused many people to choke or faint and some had foam coming out of their mouths, a sign of a gas attack. Chemical weapons believed to be sarin and chlorine were used.', 'Type': 'The chemical attack on Khan Sheikhoun resulted in at least 58 civilian casualties, including 11 children under the age of eight. Civilians and rebels were among the wounded.', 'Actor': ""Russian forces bear primary responsibility for a suspected chemical attack, according to EU's Mogherini. A Russian military source denied any involvement.\\nA Syrian military source also denied any involvement in the attack."", 'Place of death': 'The attack occurred in a rebel-held town in Idlib, Syria.\\nThe attack targeted the town of Khan Sheikhoun in the south of Idlib.', 'Date of death': ""* The suspected chemical attack occurred on Wednesday 5 April 2016.\\n* No specific date is mentioned in the article, but it's implied to be Wednesday 5 April 2016.\\n* The article does not mention a separate date of death.""}","Tuesday 4 April 2017 Russian forces responsible for awful Syria chemical attack: EUs Mogherini . EU diplomatic chief Federica Mogherini said Tuesday Russian forces bear primary responsibility for a suspected chemical attack, according to her. A Russian military source denied any involvement.\nA Syrian military source also denied any involvement in the attack.
The attack caused many people to choke or faint and some had foam coming out of their mouths, a sign of a gas attack. Chemical weapons believed to be sarin and chlorine were used.

Tuesday 4 April 2017: The suspected chemical attack occurred on Tuesday.\nNo specific date is mentioned in the article, but it's implied to be Tuesday 4 April 2017.\nThe article does not mention a separate date of death.
The attack killed at least 58 people, including Syrian Civilians living in Khan Sheikhoun. Russian forces bear primary responsibility for a suspected chemical attack. The attack targeted the town of Khan Sheikhoun in the south of Idlib.

Tuesday 4 April 2017 Russian forces bear primary responsibility for a suspected chemical attack. Civilians and rebels were among the wounded.","{'Name of casualty or group': 'Syrian Civilians living in Khan Sheikhoun', 'Gender or age group': '* The attack killed at least 58 people, including 11 children under the age of eight.\\\\n* Some victims had foam coming out of their mouths.', 'Cause of death': 'The attack caused many people to choke or faint and some had foam coming out of their mouths, a sign of a gas attack. Chemical weapons believed to be sarin and chlorine were used.', 'Type': 'The chemical attack on Khan Sheikhoun resulted in at least 58 civilian casualties, including 11 children under the age of eight. Civilians and rebels were among the wounded.', 'Actor': ""Russian forces bear primary responsibility for a suspected chemical attack, according to EU's Mogherini. A Russian military source denied any involvement.\\\\nA Syrian military source also denied any involvement in the attack."", 'Place of death': 'The attack occurred in a rebel-held town in Idlib, Syria.\\\\nSpecifically, it targeted the town of Khan Sheikhoun in the south of Idlib.', 'Date of death': ""* The suspected chemical attack occurred on Tuesday.\\\\n* No specific date is mentioned in the article, but it's implied to be Tuesday 4 April 2017.\\\\n* The article does not mention a separate date of death.""}",Tuesday 4 April 2017 Assad regime responsible for awful Syria chemical attack: EUs Mogherini . EU diplomatic chief Federica Mogherini said Tuesday the regime of Bashar al-Assad bears primary responsibility for a suspected chemical attack that killed at least 58 people in a rebel-held town in Idlib Syria including 11 children under the age of eight on Tuesday. Today the news is awful Mogherini said in an interview with media organisations in Brussels on the sidelines of a EU-UN conference that was meant to focus on the post-conflict situation in Syria. A Syrian military source strongly denied the army had used any such weapons. The attack caused many people to choke or faint and some had foam coming out of their mouths the Syrian Observatory for Human Rights said citing medical sources who described it as a sign of a gas attack. The air strikes on the town of Khan Sheikhoun in the south of rebel-held Idlib also wounded more than 60 people said the Observatory a British-based war-monitoring group. This morning at 6:30 a.m. warplanes targeted Khan Sheikhoun with gases believed to be sarin and chlorine said Mounzer Khalil head of Idlibs health authority adding that the attack had killed more than 50 people and wounded 300. Most of the hospitals in Idlib province are now overflowing with wounded people he told a news conference in Idlib. Warplanes later struck near a medical point where victims of the attack were being treated the Observatory said and civil defence workers said. The civil defence also known as the White Helmets - a rescue service that operates in opposition areas of Syria - said jets struck one of its centres in the area and the nearby medical point. It would mark the deadliest chemical attack in Syria since sarin gas killed hundreds of civilians in Ghouta near Damascus in August 2013. Western states said the Syrian government was responsible for that attack. Damascus blamed it on rebels. Military denies The Syrian military source on Tuesday denied allegations that government forces had used chemical weapons dismissing the accounts as rebel propaganda. The army has not and does not use them not in the past and not in the future because it does not have them in the first place the source said. A joint inquiry for the United Nations and the global chemical weapons watchdog has previously accused government forces of toxic gas attacks. France called for an emergency U.N. Security Council meeting about Tuesdays suspected attack. Reuters photographs showed people breathing through oxygen masks and wearing protection suits while others carried the bodies of dead children and corpses wrapped in blankets were lined up on the ground. Activists in northern Syria circulated pictures on social media showing a purported victim with foam around his mouth and rescue workers hosing down almost naked children squirming on the floor. Most of the towns streets had become empty a witness said. The conflict pits President Bashar al-Assads government helped by Russia and Iranian-backed militias against a wide array of rebel groups including some that have been supported by Turkey the United States and Gulf monarchies. The Russian Defence Ministry said on Tuesday that Russian planes had not carried out air strikes on Idlib. Syrian and Russian air strikes have battered parts of Idlib despite a ceasefire that Turkey and Russia brokered in December according to the Observatory. Turkish President Tay yip Eroding and Russian President Vladimir Putin discussed the suspected attack Turkish presidential sources said. They said the two leaders had also emphasised the importance of maintaining the ceasefire. Population ballooned Idlib province contains the largest populated area controlled by the anti-Assad rebels - both nationalist Free Syrian Army groups and Islamist factions including the former al Qaeda-linked Nusra Front. Idlibs population has ballooned with thousands of fighters and civilians shuttled out of Aleppo city and areas around Damascus that the government has retaken in recent months. US air strikes since January have also hit several areas in the rural province where militias have a powerful presence. The United Nations and the Organisation for the Prohibition of Chemical Weapons have been investigating whether Damascus is adhering to its commitments under the 2013 agreement which averted the threat of US-led military intervention. In a report in October last year the inquiry said that government forces used chemical weapons at least three times in 2014-2015 and that ISIS used mustard gas in 2015. Following the 2013 Ghouta attack the Syrian government joined the international Chemical Weapons Convention under a US-Russian deal. The government which denied its forces were behind the Ghouta attack also agreed to hand over its declared stockpile of 1300 tonnes of toxic weaponry and dismantle its chemical weapons program under international supervision. Damascus has repeatedly denied using such weapons during the six-year war which has killed hundreds of thousands and created the worlds worst refugee crisis.,"{'Name of casualty or group': '11 children under the age of eight, \nThe White Helmets (a rescue service),\nThe Free Syrian Army groups,\nThe Islamist factions including the former al Qaeda-linked Nusra Front.', 'Gender or age group': '* The attack killed at least 58 people, including 11 children under the age of eight.\n* Some victims had foam coming out of their mouths.', 'Cause of death': 'The attack caused many people to choke or faint and some had foam coming out of their mouths, a sign of a gas attack. Chemical weapons believed to be sarin and chlorine were used.', 'Type': 'The chemical attack on Khan Sheikhoun resulted in at least 58 civilian casualties, including 11 children under the age of eight. Civilians and rebels were among the wounded.', 'Actor': ""The Syrian military bears primary responsibility for a suspected chemical attack, according to EU's Mogherini. A Syrian military source denied any involvement.\nRussian planes did not carry out air strikes on Idlib, according to Russia's Defence Ministry.\nISIS used mustard gas in 2015, but no information about Russian or US forces is directly linked to the incident mentioned in the article."", 'Place of death': 'The attack occurred in a rebel-held town in Idlib, Syria.\nSpecifically, it targeted the town of Khan Sheikhoun in the south of Idlib.', 'Date of death': ""* The suspected chemical attack occurred on Tuesday.\n* No specific date is mentioned in the article, but it's implied to be Tuesday 4 April 2017.\n* The article does not mention a separate date of death.""}",Actor,Name of casualty or group,Date of death
150,,,,,"Car bomb blast kills 15 in Syrias Homs NGO AFP Thursday 6 Mar 2014 At least 15 people were killed and 12 others wounded in a car bomb blast in the central Syrian city of Homs on Thursday an NGO said. ""At least 15 people were killed and 12 others injured in the Armenian district which is home to mostly Christians and Alawites"" said Rami Abdel Rahman director of the Syrian Observatory for Human Rights. Syrias President Bashar al-Assad comes from the Alawite community a religious minority that stems from Shiite Islam. Syrias state news agency SANA reported a ""terrorist attack"" on the main street of the district ""which caused deaths injuries and damage."" The neighbourhood in the east of Homs is under government control. Homs once dubbed the ""capital"" of Syrias revolution for its prominent well-attended anti-government protests has been the scene of fierce fighting between the regime and rebels. Part of its Old City under rebel control has been subjected to a tight government siege that has left several thousand civilians trapped. In recent weeks UN and Red Crescent teams were able to evacuate some civilians and distribute food and medicine to those remaining in the besieged neighbourhoods but the operations have halted.","{'Name of casualty or group': '1. Christians\n2. Alawites\n3. Rebels', 'Gender or age group': 'No information on gender or age group of casualties. However, it is mentioned that the Armenian district where the blast occurred is home to mostly Christians and Alawites.', 'Cause of death': 'The cause of death was a car bomb blast.\nThe aggressor used a car bomb as a weapon.\nThe attack was described by Syrian state news agency SANA as a ""terrorist attack"".', 'Type': 'The car bomb blast was a terrorist attack according to SANA, with victims being mostly Christians and Alawites.', 'Actor': '* The actors responsible for the incident are referred to as ""terrorists"" by SANA, but no specific group is mentioned.\n* No information.', 'Place of death': '* The attack occurred in Homs, a city in central Syria.\n\t+ The Armenian district is the specific location where the car bomb blast took place.\n\t+ This area is home to mostly Christians and Alawites.', 'Date of death': 'The attack occurred on Thursday, March 6, 2014.'}",Actor,Date of death,Place of death
171,"Wed 17 Sep 2013 at 1459 Regional NNA - Twin car bomb explosions in the central Syrian city of Damascus on Wednesday killed at least 18 people mostly civilians from refugee camps and wounded 40 others state news agency SANA reported. The Syrian Observatory for Human Rights a Britain-based monitoring group reported the same toll in the double bombing in the Akrameh neighbourhood of Damascus. The group said the toll could rise as body parts were still being collected from the scene and several of the wounded were in serious condition. ""Two terrorist explosions near the Akrameh al-Makhzumi school and the Zaim hospital caused deaths and injuries"" Syrian state television reported. The neighbourhood is home to a majority of Alawites members of the same offshoot of Shiite Islam to which President Bashar al-Assad belongs. The district has been targeted more than once before including on June 19 when at least six people were killed in a car bomb attack. Damascus was once dubbed ""the capital of the revolution"" against Assad. Most of the city except the battered district of Waar has returned to regime control after two years of bombardment and siege.-AFP","{'Name of casualty or group': 'Civilians in Refugee Camps', 'Gender or age group': 'Mostly children were killed in the twin car bomb explosions, with no specific information about the gender of the adult casualties.', 'Cause of death': 'The cause of death was due to twin car bomb explosions.', 'Type': 'civilian)', 'Actor': 'The actors responsible for the twin car bomb explosions in Damascus are referred to as \\\\\\terrorists\\\\\\\\ by Syrian state television, but no further information is provided.', 'Place of death': 'Damascus', 'Date of death': 'September 12, 2013'}","Wed 01 Oct 2014 at 1459 Regional NNA - Twin car bomb explosions in the central Syrian city of Damascus on Wednesday killed at least 18 people mostly civilians from refugee camps and wounded 40 others state news agency SANA reported. The Syrian Observatory for Human Rights a Britain-based monitoring group reported the same toll in the double bombing in the Akrameh neighbourhood of Damascus. The group said the toll could rise as body parts were still being collected from the scene and several of the wounded were in serious condition. ""Two terrorist explosions near the Akrameh al-Makhzumi school and the Zaim hospital caused deaths and injuries"" Syrian state television reported. The neighbourhood is home to a majority of Alawites members of the same offshoot of Shiite Islam to which President Bashar al-Assad belongs. The district has been targeted more than once before including on June 19 when at least six people were killed in a car bomb attack. Damascus was once dubbed ""the capital of the revolution"" against Assad. Most of the city except the battered district of Waar has returned to regime control after two years of bombardment and siege.-AFP","{'Name of casualty or group': 'Civilians in Refugee Camps', 'Gender or age group': 'Mostly children were killed in the twin car bomb explosions, with no specific information about the gender of the adult casualties.', 'Cause of death': 'The cause of death was due to twin car bomb explosions.', 'Type': 'civilian)', 'Actor': 'The actors responsible for the twin car bomb explosions in Damascus are referred to as \\\\terrorists\\\\ by Syrian state television, but no further information is provided.', 'Place of death': 'Damascus', 'Date of death': ""The attacks occurred on Wednesday (no specific date mentioned), but based on the article's date (\\\\Wed 01 Oct 2014\\\\), we can infer that the attacks took place on October 1, 2014.""}","Wed 01 Oct 2014 at 1459 Regional NNA - Twin car bomb explosions in the central Syrian city of Homs on Wednesday killed at least 18 people mostly children and wounded 40 others state news agency SANA reported. The Syrian Observatory for Human Rights a Britain-based monitoring group reported the same toll in the double bombing in the Akrameh neighbourhood of Homs. The group said the toll could rise as body parts were still being collected from the scene and several of the wounded were in serious condition. ""Two terrorist explosions near the Akrameh al-Makhzumi school and the Zaim hospital caused deaths and injuries"" Syrian state television reported. The neighbourhood is home to a majority of Alawites members of the same offshoot of Shiite Islam to which President Bashar al-Assad belongs. The district has been targeted more than once before including on June 19 when at least six people were killed in a car bomb attack. Homs was once dubbed ""the capital of the revolution"" against Assad. Most of the city except the battered district of Waar has returned to regime control after two years of bombardment and siege.-AFP","{'Name of casualty or group': 'Children (mostly)', 'Gender or age group': 'Mostly children were killed in the twin car bomb explosions, with no specific information about the gender of the adult casualties.', 'Cause of death': 'The cause of death was due to twin car bomb explosions.', 'Type': 'Most casualties were children (Type: civilian)', 'Actor': 'The actors responsible for the twin car bomb explosions in Homs are referred to as ""terrorists"" by Syrian state television, but no further information is provided.', 'Place of death': 'The attacks occurred in Homs, specifically in the Akrameh neighbourhood.', 'Date of death': 'The attacks occurred on Wednesday (no specific date mentioned), but based on the article\'s date (""Wed 01 Oct 2014""), we can infer that the attacks took place on October 1, 2014.'}",Name of casualty or group,Place of death,Date of death
